Name,Artist,Composer,Album,Grouping,Work,Movement Number,Movement Count,Movement Name,Genre,Size,Time,Disc Number,Disc Count,Track Number,Track Count,Year,Date Modified,Date Added,Bit Rate,Sample Rate,Volume Adjustment,Kind,Equalizer,Comments,Plays,Last Played,Skips,Last Skipped,My Rating,Location
Blow Me (You Hardly Even Know Me),Red Peters,Red Peters,I Laughed I Cried I Fudged My Undies,,,,,,Comedy,4911185,122,1,1,2,18,1995,"6/21/19, 12:42 AM","6/21/19, 12:42 AM",256,44100,,Apple Music AAC audio file,,,10,"5/20/21, 11:45 AM",,,,
Filthy,Justin Timberlake,"Justin Timberlake, Timothy Mosley, Nate Hills, James Fauntleroy & Larrance Dopson",Man of the Woods,,,,,,Pop,10910413,293,1,1,1,16,2018,"6/10/19, 4:42 PM","6/10/19, 4:42 PM",256,44100,,Apple Music AAC audio file,,,14,"5/20/21, 11:50 AM",1,"11/27/20, 5:59 PM",,
"Stayin' Alive (From ""Saturday Night Fever"" Soundtrack)",Bee Gees,"Maurice Gibb, Robin Gibb & Barry Gibb",Saturday Night Fever (The Original Movie Soundtrack),,,,,,Pop,11392047,284,1,1,1,21,1977,"6/15/19, 3:30 PM","6/15/19, 3:30 PM",256,44100,,Apple Music AAC audio file,,,21,"6/7/21, 1:32 AM",,,,
Pardon Me,Incubus,"Brandon Boyd, Michael Einziger, Alex Katunich, José Pasillas II & Chris Kilmore",Make Yourself,,,,,,Alternative,8094509,223,1,1,12,13,1999,"6/19/19, 12:24 AM","6/19/19, 12:24 AM",256,44100,,Apple Music AAC audio file,,,16,"9/19/21, 9:47 AM",,,,
See You Again (feat. Charlie Puth),Wiz Khalifa,"Andrew Cedar, Cameron Thomaz, Charlie Puth, Dann Hume, Joshua Karl Simon Hardy & Phoebe Cockburn",Furious 7 (Original Motion Picture Soundtrack) [Deluxe Version],,,,,,Hip-Hop/Rap,8138574,229,1,1,7,22,2015,"6/20/19, 6:26 PM","6/20/19, 6:26 PM",256,44100,,Apple Music AAC audio file,,,36,"7/22/21, 8:43 AM",1,"5/20/21, 12:47 PM",,
All of Me,John Legend,John Stephens & Toby Gad,Love in the Future (Expanded Edition),,,,,,R&B/Soul,9460299,269,1,1,6,20,2013,"6/27/19, 12:23 AM","6/27/19, 12:23 AM",256,44100,,Apple Music AAC audio file,,,31,"5/20/21, 12:12 PM",1,"8/19/19, 3:07 AM",,
Safe and Sound,Capital Cities,Ryan Merchant & Sebu Simonian,In a Tidal Wave of Mystery (Deluxe Edition),,,,,,Alternative,6982848,192,1,1,1,16,2011,"8/3/19, 4:50 AM","8/3/19, 4:50 AM",256,44100,,Apple Music AAC audio file,,,26,"5/20/21, 12:15 PM",,,,
1984,Inteus,Nathan Koniszewski,1984 - Single,,,,,,Hip-Hop/Rap,7811416,213,1,1,1,1,2019,"8/11/19, 10:33 PM","8/11/19, 10:33 PM",256,44100,,Apple Music AAC audio file,,,24,"5/20/21, 12:18 PM",1,"8/31/19, 10:14 PM",,
In Too Deep,Superior.,Ramon Eduardo Villamediana,In Too Deep - Single,,,,,,Hip-Hop/Rap,7033780,200,1,1,1,1,2019,"8/11/19, 10:30 PM","8/11/19, 10:30 PM",256,44100,,Apple Music AAC audio file,,,31,"5/20/21, 12:22 PM",,,,
Old Number Seven,The Devil Makes Three,,The Devil Makes Three,,,,,,Singer/Songwriter,7108670,200,1,1,6,14,2002,"9/4/18, 8:51 PM","9/4/18, 8:51 PM",256,44100,,Apple Music AAC audio file,,,61,"5/20/21, 12:29 PM",2,"1/3/19, 9:34 PM",,
Desperado,Rihanna,"Krystin""""Rook Monroe""""Watkins"", Mick Schultz, Robyn Rihanna Fenty, James Fauntleroy & D. Rachel",ANTI (Deluxe),,,,,,Pop,6747810,186,1,1,5,16,2016,"6/27/19, 12:09 AM","6/27/19, 12:09 AM",256,44100,,Apple Music AAC audio file,,,69,"5/20/21, 12:32 PM",,,,
Señorita,Shawn Mendes & Camila Cabello,"Shawn Mendes, Camila Cabello, Andrew Wotman, Benjamin Levin, Ali Tamposi, Charlotte Emma Aitchison, Jack Patterson & Magnus August Hoiberg",Señorita - Single,,,,,,Pop,6840011,190,1,1,1,1,2019,"8/3/19, 4:52 AM","8/3/19, 4:52 AM",256,44100,,Apple Music AAC audio file,,,49,"7/21/21, 11:11 AM",,,,
Renegades of Funk,Rage Against the Machine,"Afrika Bambaataa, Arthur Baker, John Robie & John Miller",Renegades,,,,,,Hard Rock,9543269,274,1,1,4,12,2000,"8/20/19, 9:16 PM","8/20/19, 9:16 PM",256,44100,,Apple Music AAC audio file,,,27,"7/23/21, 9:11 AM",,,,
Mudshovel,Staind,"Aaron Lewis, Johnny April, Jon Wysocki & Mike Mushok",Dysfunction,,,,,,Hard Rock,10559202,282,1,1,5,10,1999,"8/20/19, 9:19 PM","8/20/19, 9:19 PM",256,44100,,Apple Music AAC audio file,,,21,"9/19/21, 8:35 AM",,,,
Phonk (feat. No Money),SQBI,Green Pickollo,Blaq Flaq,,,,,,Hip-Hop/Rap,9538436,272,1,1,7,9,2019,"8/11/19, 10:44 PM","8/11/19, 10:44 PM",256,44100,,Apple Music AAC audio file,,,18,"7/21/21, 11:25 AM",,,,
I Don't Wanna Use Your Love Tonight,DJ K.O.,Frank Earullo,"Fist Pump, Vol. 7",,,,,,Pop,2533056,60,1,1,4,28,2013,"8/26/19, 5:49 PM","8/26/19, 5:49 PM",256,44100,,Apple Music AAC audio file,,,24,"7/22/21, 8:31 AM",2,"9/12/19, 12:22 PM",,
Sex with Me (MK Remix),Rihanna,"Matthew Samuels, Adam Feeney, Robyn Rihanna Fenty, C. John ""Jack"" Hansen, Jahron Anthony Brathwaite & ANDERSON HERNANDEZ",Sex with Me (Dance Remixes) - EP,,,,,,Dance,13048675,378,1,1,1,5,2017,"8/26/19, 3:07 PM","8/26/19, 3:07 PM",256,44100,,Apple Music AAC audio file,,,16,"7/21/21, 11:32 AM",2,"5/20/21, 12:47 PM",,
Radioactive (Grouplove & Captain Cuts Remix),Imagine Dragons,"Dan Reynolds, Wayne Sermon, Ben McKee, Alex Da Kid & Josh Mosser",Radioactive (Grouplove & Captain Cuts Remix) - Single,,,,,,Alternative,8653893,241,1,1,1,1,2013,"8/26/19, 3:24 PM","8/26/19, 3:24 PM",256,44100,,Apple Music AAC audio file,,,20,"7/22/21, 8:39 AM",,,,
See You Again (feat. Charlie Puth),Wiz Khalifa,"Andrew Cedar, Cameron Thomaz, Charlie Puth, Dann Hume, Joshua Karl Simon Hardy & Phoebe Cockburn",Furious 7 (Original Motion Picture Soundtrack) [Deluxe Version],,,,,,Hip-Hop/Rap,8138574,229,1,1,7,22,2015,"6/20/19, 6:26 PM","6/20/19, 6:26 PM",256,44100,,Apple Music AAC audio file,,,36,"7/22/21, 8:43 AM",1,"5/20/21, 12:47 PM",,
See You Again,Elle King,Elle King & Francis White,Love Stuff,,,,,,Alternative,,206,1,1,12,12,2015,"11/14/15, 10:00 AM","11/14/15, 4:00 PM",256,44100,,Purchased AAC audio file,,,36,"7/22/21, 8:46 AM",1,"9/12/19, 12:22 PM",,
Walking (feat. Swae Lee & Major Lazer),"88rising, Joji & Jackson Wang","Boaz de Jong, George Miller, Gregory Hein, Jackson Wang, Khalif Malik Ibn Shaman Brown, Maximilian Jaeger, Montana Wayne Best, Robin P. Francesco & Thomas Pentz",Head in the Clouds II,,,,,,Pop,6027849,167,1,1,5,16,2019,"10/22/19, 11:36 AM","10/22/19, 11:36 AM",256,44100,,Apple Music AAC audio file,,,21,"7/22/21, 11:56 AM",,"12/7/20, 12:17 PM",,
Earned It (Fifty Shades of Grey),The Weeknd,"Abel Tesfaye, Stephan Moccio, Jason 'Daheala' Quenneville & Ahmad Balshe",Beauty Behind the Madness,,,,,,R&B/Soul,,277,1,1,9,14,2015,"10/23/15, 3:16 PM","10/23/15, 3:16 PM",256,44100,,Purchased AAC audio file,,,92,"7/22/21, 12:01 PM",,,,
Bad Things,Machine Gun Kelly & Camila Cabello,"Camila Cabello, Colson Baker pka ""MGK"" for EST, M. LOVE, Tony Scalzo, Alex Schwartz, Joseph Khajadourian & Steve Basil",bloom,,,,,,Hip-Hop/Rap,8443115,239,1,1,10,15,2016,"8/28/19, 7:43 PM","8/28/19, 7:43 PM",256,44100,,Apple Music AAC audio file,,,108,"7/22/21, 12:05 PM",,,,
Sex,Cheat Codes & Kris Kross Amsterdam,"Hurby Azor, T. Dahl, S. Huisman, J. Huisman, BEARCLVW, K. Pederson, R. Elifritz & M. Elifritz",Sex - Single,,,,,,Dance,8060590,228,1,1,1,1,2016,"9/24/19, 7:41 PM","9/24/19, 7:41 PM",256,44100,,Apple Music AAC audio file,,,64,"1/3/22, 7:44 AM",4,"12/29/21, 2:40 PM",,
In the Air Tonight,In This Moment,Phil Collins,Ritual,,,,,,Metal,10330352,297,1,1,4,12,2017,"6/8/19, 11:54 PM","6/8/19, 11:54 PM",256,44100,,Apple Music AAC audio file,,,11,"12/27/20, 5:27 AM",,,,
Just Us (feat. SZA),DJ Khaled,"Khaled Khaled, Solana Rowe, Denisia Blujune Andrews, Brittany ""@Chi_Coney"" Coney, André Benjamin, Antwan Patton & David Sheats",Father of Asahd,,,,,,Hip-Hop/Rap,7832693,221,1,1,4,15,2019,"8/2/19, 7:17 PM","8/2/19, 7:17 PM",256,44100,,Apple Music AAC audio file,,,120,"5/20/21, 1:20 PM",,"11/27/20, 8:01 PM",,
Eastside,"benny blanco, Halsey & Khalid","benny blanco, Nathan Perez, Khalid Robinson, Ashley Frangipane & Ed Sheeran",FRIENDS KEEP SECRETS,,,,,,Pop,6229814,170,1,1,1,7,2018,"9/19/19, 7:59 AM","9/19/19, 7:59 AM",256,44100,,Apple Music AAC audio file,,,97,"1/3/22, 9:30 PM",,"1/19/21, 2:55 PM",,
Drive (feat. Delilah Montagu) [Edit],Black Coffee & David Guetta,"David Guetta, Illsey Juber, Nkosinathi Maphumulo, Phillip Fender, Ralph Wegner, Mikkel S. Eriksen & Tor Erik Hermansen",Drive (feat. Delilah Montagu) - Single,,,,,,Dance,6876292,191,1,1,1,2,2018,"9/19/19, 8:01 AM","9/19/19, 8:01 AM",256,44100,,Apple Music AAC audio file,,,75,"5/20/21, 1:26 PM",,,,
Diamonds,Rihanna,"Sia Furler, Benjamin Levine, Mikkel S. Eriksen & Tor Erik Hermansen",Diamonds - Single,,,,,,Pop,7939251,225,1,1,1,1,2012,"10/23/19, 12:16 AM","10/23/19, 12:16 AM",256,44100,,Apple Music AAC audio file,,,18,"5/20/21, 1:30 PM",,,,
I Miss You,blink-182,"Mark Hoppus, Tom DeLonge & Travis Barker",Blink-182 (Bonus Track Version),,,,,,Rock,8783313,227,1,1,3,16,2003,"9/24/19, 9:10 PM","9/24/19, 9:10 PM",256,44100,,Apple Music AAC audio file,,,61,"7/23/21, 8:38 AM",1,"11/9/19, 12:37 AM",,
Green Light (Chromeo Remix),Lorde,"Ella Yelich-O'connor, Jack Antonoff & Joel Little",Green Light (Chromeo Remix) - Single,,,,,,Alternative,8916690,247,1,1,1,1,2017,"8/26/19, 3:20 PM","8/26/19, 3:20 PM",256,44100,,Apple Music AAC audio file,,,52,"5/20/21, 1:38 PM",,"11/27/20, 8:01 PM",,
Him & I,G-Eazy & Halsey,"Gerald Gillum, Alexander Schwartz, Joe Khajadourian & Ashley Frangipane",The Beautiful & Damned,,,,,,Hip-Hop/Rap,9364903,268,1,1,3,20,2017,"4/6/18, 11:42 PM","4/6/18, 11:42 PM",256,44100,,Apple Music AAC audio file,,,34,"5/20/21, 1:42 PM",1,"11/27/20, 8:01 PM",,
Drive (feat. Delilah Montagu),Black Coffee & David Guetta,"David Guetta, Ralph Wegner, Phillip Fender, Mikkel S. Eriksen, Illsey Juber, Nkosinathi Maphumulo & Tor Erik Hermansen",Drive (feat. Delilah Montagu) - Single,,,,,,Dance,10123394,283,1,1,2,2,2018,"9/19/19, 8:01 AM","9/19/19, 8:01 AM",256,44100,,Apple Music AAC audio file,,,31,"5/20/21, 1:47 PM",,,,
bad guy,Billie Eilish,FINNEAS & Billie Eilish,"WHEN WE ALL FALL ASLEEP, WHERE DO WE GO?",,,,,,Alternative,7155654,194,1,1,2,14,2019,"6/3/19, 9:06 PM","6/3/19, 9:06 PM",256,44100,,Apple Music AAC audio file,,,61,"5/20/21, 1:50 PM",,,,
Sunflower (Spider-Man: Into the Spider-Verse),Post Malone & Swae Lee,"Carter Lang, Khalif Malik Ibin Shaman Brown, Louis Russel Bell, Austin Richard Post, William Walsh & Carl Rosen",Spider-Man: Into the Spider-Verse (Soundtrack From & Inspired by the Motion Picture),,,,,,Hip-Hop/Rap,5797498,158,1,1,2,13,2018,"3/24/19, 2:14 AM","3/24/19, 2:14 AM",256,44100,,Apple Music AAC audio file,,,72,"5/20/21, 1:53 PM",,,,
Better Now,Post Malone,"Louis Bell, Austin Post, Billy Walsh & Adam Feeney",beerbongs & bentleys,,,,,,Hip-Hop/Rap,8205629,231,1,1,9,18,2018,"5/31/19, 8:59 PM","5/31/19, 8:59 PM",256,44100,,Apple Music AAC audio file,,,72,"5/20/21, 1:57 PM",,,,
Hustler Musik,Lil Wayne,D. Carter & T-Mix,Tha Carter II,,,,,,Hip-Hop/Rap,10635094,303,1,1,14,22,2005,"10/23/19, 12:47 AM","10/23/19, 12:47 AM",256,44100,,Apple Music AAC audio file,,,34,"5/20/21, 2:02 PM",,,,
Cool Girl,Tove Lo,"Tove Lo, Ludvig Söderberg & Jakob Jerlström",Lady Wood,,,,,,Alternative,7193121,199,1,1,5,12,2016,"9/24/19, 7:39 PM","9/24/19, 7:39 PM",256,44100,,Apple Music AAC audio file,,,77,"5/20/21, 2:48 PM",,"11/27/20, 8:00 PM",,
Sex,Cheat Codes & Kris Kross Amsterdam,"Hurby Azor, T. Dahl, S. Huisman, J. Huisman, BEARCLVW, K. Pederson, R. Elifritz & M. Elifritz",Sex - Single,,,,,,Dance,8060590,228,1,1,1,1,2016,"9/24/19, 7:41 PM","9/24/19, 7:41 PM",256,44100,,Apple Music AAC audio file,,,64,"1/3/22, 7:44 AM",4,"12/29/21, 2:40 PM",,
Broken,lovelytheband,Christian Medice & Mitchell Collins,Everything I Could Never Say... - EP,,,,,,Alternative,7447943,204,1,1,1,6,2017,"9/24/19, 9:12 PM","9/24/19, 9:12 PM",256,44100,,Apple Music AAC audio file,,,85,"7/22/21, 1:57 PM",2,"7/22/21, 1:54 PM",,
Fast Car,Jasmine Thompson,"Jasmine Thompson, Jeremy Dussolliet & Timothy Sommers",Fast Car - Single,,,,,,Pop,7712174,218,1,1,1,1,2016,"4/14/19, 10:19 PM","4/14/19, 10:19 PM",256,44100,,Apple Music AAC audio file,,,77,"5/20/21, 2:16 PM",1,"10/23/19, 10:32 PM",,
I Miss You,blink-182,"Mark Hoppus, Tom DeLonge & Travis Barker",Blink-182 (Bonus Track Version),,,,,,Rock,8783313,227,1,1,3,16,2003,"9/24/19, 9:10 PM","9/24/19, 9:10 PM",256,44100,,Apple Music AAC audio file,,,61,"7/23/21, 8:38 AM",1,"11/9/19, 12:37 AM",,
Sucker,Jonas Brothers,"Frank Dukes, Ryan Tedder, Louis Bell, Joe Jonas, Nick Jonas & Kevin Jonas",Happiness Begins,,,,,,Pop,6489483,181,1,1,1,14,2019,"9/6/19, 8:48 PM","9/6/19, 8:48 PM",256,44100,,Apple Music AAC audio file,,,30,"5/20/21, 2:23 PM",1,"11/9/19, 12:37 AM",,
Fuego,Alok & Bhaskar,A. Petrillo & R. Amarante,Fuego - Single,,,,,,Dance,7012939,188,1,1,1,1,2017,"10/24/19, 12:00 AM","10/24/19, 12:00 AM",256,44100,,Apple Music AAC audio file,,,25,"5/20/21, 2:26 PM",,"11/27/20, 8:00 PM",,
Girls Have Fun (feat. G-Eazy & Rich The Kid),Tyga,"William Grigahcine, Michael Stevenson, Dimitri Roger & Gerald Gillum",Girls Have Fun (feat. G-Eazy & Rich The Kid) - Single,,,,,,Hip-Hop/Rap,6383923,175,1,1,1,1,2019,"10/24/19, 12:18 AM","10/24/19, 12:18 AM",256,44100,,Apple Music AAC audio file,,,19,"5/20/21, 2:29 PM",,,,
Specta (Deepfunk Remix),Castano & Four Candles,,French Hello / Specta - EP,,,,,,Dance,15538859,453,1,1,4,4,2015,"11/11/19, 9:41 PM","11/11/19, 9:41 PM",256,44100,,Apple Music AAC audio file,,,11,"12/27/20, 6:47 AM",,,,
Perfect,Ed Sheeran,Ed Sheeran,÷ (Deluxe),,,,,,Pop,9263610,263,1,1,5,16,2017,"10/31/19, 12:23 AM","10/31/19, 12:23 AM",256,44100,,Apple Music AAC audio file,,,10,"12/27/20, 6:51 AM",2,"5/20/21, 2:29 PM",,
Sign of the Times,Harry Styles,"Harry Styles, Jeff Bhasker, Mitch Rowland, Ryan Nasci, Alex Salibian & Tyler Johnson",Harry Styles,,,,,,Pop,11794676,340,1,1,2,10,2017,"12/6/19, 2:18 PM","12/6/19, 2:18 PM",256,44100,,Apple Music AAC audio file,,,34,"7/22/21, 1:21 PM",2,"11/27/20, 8:00 PM",,
Pop Tart,Margolnick,Drake Margolnick,Pop Tart EP,,,,,,Alternative,8256737,226,1,1,1,4,2018,"11/11/19, 9:42 PM","11/11/19, 9:42 PM",256,44100,,Apple Music AAC audio file,,,35,"7/22/21, 1:24 PM",,,,
Colors,St. Beauty,,Running to the Sun,,,,,,R&B/Soul,7370534,200,1,1,7,10,2018,"10/7/19, 12:14 AM","10/7/19, 12:14 AM",256,44100,,Apple Music AAC audio file,,,37,"7/22/21, 1:28 PM",,,,
In the Air Tonight,"Panski, John Skyfield & Dana Kelson",,In the Air Tonight - Single,,,,,,House,6569765,184,1,1,1,1,2018,"10/23/19, 11:10 PM","10/23/19, 11:10 PM",256,44100,,Apple Music AAC audio file,,,41,"7/22/21, 1:31 PM",1,"11/27/20, 8:00 PM",,
Cool Girl,Tove Lo,"Tove Lo, Ludvig Söderberg & Jakob Jerlström",Lady Wood,,,,,,Alternative,7193121,199,1,1,5,12,2016,"9/24/19, 7:39 PM","9/24/19, 7:39 PM",256,44100,,Apple Music AAC audio file,,,77,"5/20/21, 2:48 PM",,"11/27/20, 8:00 PM",,
Go Head,Rocstrong,Andre Mbayi Bangala,Sowyg - EP,,,,,,Alternative,5813409,159,1,1,4,6,2014,"11/2/19, 1:11 AM","11/2/19, 1:11 AM",256,44100,,Apple Music AAC audio file,,,40,"7/22/21, 1:37 PM",1,"5/10/21, 2:35 PM",,
Time of Our Lives,Pitbull & Ne-Yo,N/A,Globalization,,,,,,Pop,8556108,229,1,1,4,10,2014,"11/12/19, 11:24 PM","11/12/19, 11:24 PM",256,44100,,Apple Music AAC audio file,,,29,"7/22/21, 1:44 PM",,,,
Slow for Me (feat. Tory Lanez),Melii,"Audrey Ducassee, Mathias Hansmann & Daystar Peterson",phAses,,,,,,R&B/Soul,7056539,201,1,1,3,14,2019,"10/24/19, 12:21 AM","10/24/19, 12:21 AM",256,44100,,Apple Music AAC audio file,,,23,"5/20/21, 7:12 PM",2,"11/27/20, 8:00 PM",,
Careless Whisper,Nataly Dawn,,Careless Whisper - Single,,,,,,Singer/Songwriter,6337689,163,1,1,1,1,2017,"11/26/19, 8:11 PM","11/26/19, 8:11 PM",256,44100,,Apple Music AAC audio file,,,17,"5/20/21, 7:15 PM",,,,
Levels,Avicii,"Tim Bergling, Ash Pournouri, Leroy Kirkland, Pearl Woods & Etta James",Levels (Remixes) - EP,,,,,,Dance,11842340,338,1,1,2,4,2011,"11/6/19, 12:44 AM","11/6/19, 12:44 AM",256,44100,,Apple Music AAC audio file,,,27,"5/20/21, 7:21 PM",1,"11/27/20, 7:59 PM",,
Regulate (feat. Nate Dogg),Warren G,Nathaniel Hale,Regulate...G Funk Era (20th Anniversary Edition),,,,,,Hip-Hop/Rap,8795655,248,1,1,1,15,1994,"11/16/19, 7:05 PM","11/16/19, 7:05 PM",256,44100,,Apple Music AAC audio file,,,28,"5/20/21, 7:39 PM",,"11/27/20, 7:59 PM",,
I Kissed a Girl,Katy Perry,,I Kissed a Girl - Single,,,,,,Pop,6355006,180,1,1,1,1,2008,"9/13/08, 11:58 AM","8/25/08, 9:10 PM",256,44100,,AAC audio file,,,21,"5/10/21, 2:57 PM",,"11/27/20, 7:59 PM",,
Picture (feat. Sheryl Crow),Kid Rock,"Sheryl Crow, R.J. Ritchie & Robert J. Ritchie",Cocky,,,,,,Hard Rock,10416040,298,1,1,9,14,2001,"11/18/19, 12:58 AM","11/18/19, 12:58 AM",256,44100,,Apple Music AAC audio file,,,22,"5/21/21, 3:01 PM",,,,
Sexy and I Know It,LMFAO,"S.K. Gordy, K. Oliver, G. M. Robertson, D. J. Listenbee & E. E. Beck",Sorry for Party Rocking (Edited Version),,,,,,Pop,7377654,199,1,1,4,11,2011,"11/18/19, 1:03 AM","11/18/19, 1:03 AM",256,44100,,Apple Music AAC audio file,,,19,"5/21/21, 3:05 PM",,"11/27/20, 7:59 PM",,
Many Men (Wish Death),50 Cent,"Curtis Jackson, Darrell Branch, Luis Resto, Frederick J. Perren & Keni St.Lewis",Get Rich or Die Tryin',,,,,,Hip-Hop/Rap,8987598,256,1,1,4,19,2003,"11/18/19, 1:41 AM","11/18/19, 1:41 AM",256,44100,,Apple Music AAC audio file,,,16,"5/21/21, 3:09 PM",,,,
Boulevard of Broken Dreams,Green Day,"Green Day, Billie Joe Armstrong, Frank Wright, Michael Pritchard, Mike Dirnt & Tré Cool",American Idiot,,,,,,Alternative,9274075,260,1,1,4,13,2004,"1/2/19, 6:31 AM","1/2/19, 6:31 AM",256,44100,,Apple Music AAC audio file,,,46,"12/20/21, 7:54 AM",1,"1/2/19, 6:31 AM",,
Broken,lovelytheband,Christian Medice & Mitchell Collins,Everything I Could Never Say... - EP,,,,,,Alternative,7447943,204,1,1,1,6,2017,"9/24/19, 9:12 PM","9/24/19, 9:12 PM",256,44100,,Apple Music AAC audio file,,,85,"7/22/21, 1:57 PM",2,"7/22/21, 1:54 PM",,
Old Town Road,Lil Nas X,"Montero Lamar Hill, Michael Trent Reznor & Atticus Matthew Ross",7 - EP,,,,,,Hip-Hop/Rap,4278627,113,1,1,8,8,2018,"9/6/19, 8:43 PM","9/6/19, 8:43 PM",256,44100,,Apple Music AAC audio file,,,90,"1/5/22, 1:48 PM",3,"1/5/22, 1:46 PM",,
Schism,TOOL,TOOL,Lateralus,,,,,,Metal,14212109,407,1,1,5,13,2001,"12/6/19, 1:41 AM","12/6/19, 1:41 AM",256,44100,,Apple Music AAC audio file,,,6,"5/21/21, 3:25 PM",1,"7/22/21, 1:59 PM",,
High Hopes,Panic! At the Disco,"Brendon Urie, Ilsey Juber, Jake Sinclair, Jenny Owen Youngs, Jonas Jeberg, Lauren Pritchard, Sam Hollander, Tayla Parx & William Lobbin Bean",Pray for the Wicked,,,,,,Alternative,6801847,190,1,1,4,11,2018,"7/4/19, 7:38 AM","7/4/19, 7:38 AM",256,44100,,Apple Music AAC audio file,,,45,"1/3/22, 10:03 AM",2,,,
Love and Happiness,Al Green,Not Documented,I'm Still in Love with You,,,,,,Soul,11935522,307,1,1,3,9,1972,"1/1/20, 5:39 PM","1/1/20, 5:39 PM",256,44100,,Apple Music AAC audio file,,,5,"5/21/21, 3:34 PM",,"11/27/20, 7:58 PM",,
Sign of the Times,Harry Styles,"Harry Styles, Jeff Bhasker, Mitch Rowland, Ryan Nasci, Alex Salibian & Tyler Johnson",Harry Styles,,,,,,Pop,11794676,340,1,1,2,10,2017,"12/6/19, 2:18 PM","12/6/19, 2:18 PM",256,44100,,Apple Music AAC audio file,,,34,"7/22/21, 1:21 PM",2,"11/27/20, 8:00 PM",,
Umbrella (feat. JAY-Z),Rihanna,Thaddis Harrell & Shawn Carter,Don't Stop the Music Hit Pack - Single,,,,,,Pop,9698400,275,1,1,1,3,2007,"12/11/19, 11:52 PM","12/11/19, 11:52 PM",256,44100,,Apple Music AAC audio file,,,19,"5/21/21, 5:23 PM",,"11/27/20, 7:58 PM",,
Here,Alessia Cara,"Alessia Caracciolo, Andrew ""Pop"" Wansel, Warren ""Oak"" Felder, Coleridge Tillman, Isaac Hayes, Samuel Gerongco, Robert Gerongco & Terence Lam",Know-It-All (Deluxe),,,,,,Pop,,199,1,1,2,13,2015,"3/14/16, 9:00 PM","3/15/16, 3:00 AM",256,44100,,Purchased AAC audio file,,,57,"5/21/21, 5:26 PM",3,"7/22/21, 2:04 PM",,
Someone You Loved,Lewis Capaldi,"Lewis Capaldi, Pete Kelleher, Tom Barnes, Benjamin Kohn & Sam Roman",Divinely Uninspired To A Hellish Extent,,,,,,Alternative,6524098,182,1,1,4,12,2018,"1/21/20, 4:45 PM","1/21/20, 4:45 PM",256,44100,,Apple Music AAC audio file,,,19,"5/21/21, 5:29 PM",3,"7/22/21, 2:04 PM",,
Happier,Marshmello & Bastille,"Marshmello, Dan Smith & Steve Mac",Happier - Single,,,,,,Dance,7738667,214,1,1,1,1,2018,"12/21/19, 8:17 AM","12/21/19, 8:17 AM",256,44100,,Apple Music AAC audio file,,,25,"7/22/21, 2:08 PM",1,"2/5/20, 7:56 PM",,
South of the Border (feat. Camila Cabello & Cardi B),Ed Sheeran,"Belcalis Almanzar, Camila Cabello, Ed Sheeran, Fred Gibson, Jordan Thorpe & Steve Mac",No.6 Collaborations Project,,,,,,Pop,7250227,204,1,1,2,14,2019,"1/21/20, 5:14 PM","1/21/20, 5:14 PM",256,44100,,Apple Music AAC audio file,,,27,"7/22/21, 2:11 PM",,,,
What a Man Gotta Do,Jonas Brothers,"David Stewart, Ryan Tedder, Nick Jonas, Kevin Jonas, Joe Jonas & Jessica Agombar",What a Man Gotta Do - Single,,,,,,Pop,6772309,180,1,1,1,1,2020,"1/22/20, 11:20 AM","1/22/20, 11:20 AM",256,44100,,Apple Music AAC audio file,,,26,"7/22/21, 2:14 PM",1,"1/29/20, 11:27 AM",,
I Like Me Better,Lauv,Ari Leff & Michael Matosic,I Like Me Better - Single,,,,,,Pop,7094968,197,1,1,1,1,2017,"1/22/20, 3:02 PM","1/22/20, 3:02 PM",256,44100,,Apple Music AAC audio file,,,29,"7/22/21, 2:18 PM",1,"1/29/20, 11:27 AM",,
Stay With Me,Sam Smith,"Sam Smith, James Napier & William Phillips",In the Lonely Hour,,,,,,Pop,6267149,172,1,1,3,10,2014,"1/24/20, 1:55 AM","1/24/20, 1:55 AM",256,44100,,Apple Music AAC audio file,,,46,"5/21/21, 6:33 PM",2,"2/11/20, 5:14 PM",,
Blinding Lights,The Weeknd,"Max Martin, Oscar Holter, Abel Tesfaye, Ahmad Balshe & Jason 'Daheala' Quenneville",Blinding Lights - Single,,,,,,R&B/Soul,7138917,201,1,1,1,1,2019,"1/23/20, 11:59 PM","1/23/20, 11:59 PM",256,44100,,Apple Music AAC audio file,,,61,"7/22/21, 2:22 PM",,,,
Strangelove (Maxi Mix Version),Depeche Mode,Martin Gore,Strangelove,,,,,,Pop,13502282,394,1,1,3,8,1987,"2/12/20, 4:23 PM","2/12/20, 4:23 PM",256,44100,,Apple Music AAC audio file,,,38,"5/21/21, 6:43 PM",2,"7/22/21, 2:22 PM",,
Sun Goes Down (feat. Isadora),Bruno Martini,Bruno Martini & Zeeba,Sun Goes Down (feat. Isadora) - Single,,,,,,Electronic,7317024,203,1,1,1,1,2017,"2/28/20, 6:55 PM","2/28/20, 6:55 PM",256,44100,,Apple Music AAC audio file,,,30,"1/3/22, 10:04 AM",,,,
Dance Monkey,Tones And I,Toni Watson,The Kids Are Coming - EP,,,,,,Alternative,7473522,209,1,1,2,6,2019,"1/24/20, 6:27 PM","1/24/20, 6:27 PM",256,44100,,Apple Music AAC audio file,,,107,"1/4/22, 1:31 PM",1,"11/27/20, 7:57 PM",,
Sweater Weather,The Neighbourhood,"Jesse James Rutherford, Zachary Abels & Jeremy Freedman",I Love You.,,,,,,Alternative,,240,1,1,4,11,2013,"12/31/15, 7:40 AM","12/31/15, 1:40 PM",256,44100,,Purchased AAC audio file,,,143,"1/3/22, 10:12 AM",,,,
Piece Of Your Heart,Meduza & Goodboys,"Mattia Vitale, Simone Giani, Luca De Gregorio, Joshua Grimmett, Connor Manning & Nathan Cross",Piece Of Your Heart - Single,,,,,,Dance,5562884,152,1,1,1,1,2019,"3/4/20, 10:22 PM","3/4/20, 10:22 PM",256,44100,,Apple Music AAC audio file,,,28,"1/4/22, 2:49 PM",,"11/27/20, 7:57 PM",,
Gimme Shelter,Puddle of Mudd,Mick Jagger & Keith Richards,Gimme Shelter - Single,,,,,,Alternative,11758206,305,1,1,1,1,2011,"3/4/20, 6:53 PM","3/4/20, 6:53 PM",256,44100,,Apple Music AAC audio file,,,13,"1/3/22, 10:20 AM",,"11/27/20, 7:57 PM",,
Take Me Home (feat. Bebe Rexha) [Acoustic],Cash Cash,"Bebe Rexha, Alexander Makhlouf, Brandon Lowry, Jean Paul Makhlouf & Samuel Warren Frisch",Overtime - EP,,,,,,Dance,6738443,184,1,1,7,7,2013,"3/4/20, 6:07 PM","3/4/20, 6:07 PM",256,44100,,Apple Music AAC audio file,,,12,"1/3/22, 10:23 AM",1,"7/3/20, 2:41 PM",,
Tipsy (Club Mix),J-Kwon,"Jerrell Jones, Joe Kent & Mark Williams",Hood Hop,,,,,,Hip-Hop/Rap,8563280,243,1,1,3,15,2004,"3/4/20, 4:56 PM","3/4/20, 4:56 PM",256,44100,,Apple Music AAC audio file,,,9,"1/3/22, 10:27 AM",3,"7/22/21, 2:41 PM",,
No Diggity,Blackstreet,"Teddy Riley, LENISE WALTERS, Bill Withers, William Stewart & Chauncey Hannibal",No Diggity (Cooler Than Now Remix) - Single,,,,,,Hip-Hop,9524451,272,1,1,1,2,2010,"2/5/20, 7:07 PM","2/5/20, 7:07 PM",256,44100,,Apple Music AAC audio file,,,33,"1/3/22, 10:31 AM",1,"11/27/20, 7:57 PM",,
Save Tonight (feat. Pearl Andersson) [Wideboys Remix],Jayddyn,"Eagle-Eye Cherry, RAPHAEL MONSANTO & Sean M. Lowe",Save Tonight (feat. Pearl Andersson) [Wideboys Remix] - Single,,,,,,Pop,8434555,240,1,1,1,1,2018,"2/5/20, 7:14 PM","2/5/20, 7:14 PM",256,44100,,Apple Music AAC audio file,,,29,"1/3/22, 10:35 AM",2,"7/22/21, 2:41 PM",,
Darkside,blink-182,"Mark Hoppus, Travis Barker, Matt Skiba & John Feldmann",NINE,,,,,,Rock,6810103,180,1,1,4,15,2019,"2/5/20, 7:21 PM","2/5/20, 7:21 PM",256,44100,,Apple Music AAC audio file,,,24,"1/3/22, 10:38 AM",2,"11/27/20, 7:56 PM",,
Sandstorm,Darude,,Before the Storm,,,,,,Dance,8730047,225,1,1,1,15,1999,"3/4/20, 7:19 PM","3/4/20, 7:19 PM",256,44100,,Apple Music AAC audio file,,,6,"1/3/22, 10:42 AM",1,"7/22/21, 2:41 PM",,
faultline,Reuben And The Dark,"Reuben Bullock, Ian Jarvis, Brock Geiger, Brendan 'Dino' Soares & Christoper Lloyd Hayden",un  love,,,,,,Alternative,8888140,246,1,1,2,10,2019,"2/5/20, 7:33 PM","2/5/20, 7:33 PM",256,44100,,Apple Music AAC audio file,,,20,"1/3/22, 10:46 AM",1,"7/22/21, 2:41 PM",,
Titty Dancer,Dan Diamond,,Titty Dancer - EP,,,,,,Electronic,9573514,263,1,1,1,4,2007,"2/5/20, 6:40 PM","2/5/20, 6:40 PM",256,44100,,Apple Music AAC audio file,,,22,"1/3/22, 10:50 AM",,"11/27/20, 7:56 PM",,
Time After Time,INOJ,,Ready For The World,,,,,,R&B/Soul,8879268,255,1,1,13,15,1998,"3/4/20, 7:09 PM","3/4/20, 7:09 PM",256,44100,,Apple Music AAC audio file,,,10,"5/22/21, 11:44 AM",1,"7/22/21, 2:41 PM",,
White Room,Cream,Jack Bruce & Peter Brown,Wheels of Fire,,,,,,Rock,11525305,303,1,1,1,14,1968,"2/8/20, 8:16 PM","2/8/20, 8:16 PM",256,44100,,Apple Music AAC audio file,,,18,"1/3/22, 10:56 AM",1,"7/3/20, 3:05 PM",,
I Was Made for Lovin' You,Kiss,"Desmond Child, Vincent Poncia & Paul Stanley",Dynasty,,,,,,Hard Rock,9411356,269,1,1,1,9,1979,"3/4/20, 6:55 PM","3/4/20, 6:55 PM",256,44100,,Apple Music AAC audio file,,,6,"1/3/22, 11:00 AM",1,"11/18/20, 5:20 PM",,
Lover,Taylor Swift,Taylor Swift,Lover,,,,,,Pop,7859035,221,1,1,3,18,2019,"1/22/20, 5:16 PM","1/22/20, 5:16 PM",256,44100,,Apple Music AAC audio file,,,28,"1/3/22, 11:04 AM",4,"11/18/20, 5:19 PM",,
